{"bundle_version":"5.0","run_id":"v50-2-nominal-r1-s1","attempt":"a003","clip_id":"2-nominal-r1","seed":1,"live":false,"exported_at":"2026-10-15T22:39:01+00:00","batch":{"name":"20261015-09-eval-6-v5.0-program-first","created":"2026-10-15T21:00:07.654167+00:00","candidate_revision":"v5.0"},"provenance":{"sut_commit":"5ff6b8a8988aa167df415fb3da5d50416d8f64f3","study_commit":"47e7d8354b0f583513c00d0d1f05297800e00695","service_commit":"7ffc6a8a805019ee64f2e646df50b2136411d5b9","orchestrator":{"model":"nemotron-3.5-lightning-30b-a3b","revision":"bee7596271d1495f6992ae224aefde4410e816b8","temperature":1.0,"top_p":0.95},"perception":{"model":"gemma-4-26b-a4b","revision":"4d7ae4984b7db7de8f8457170b3f1a419ee76d52","temperature":0.1},"tracking":{"contract":"vehicle-tracking-v1","weights_sha256":"646f8bc3fe0a656803d95c294f7852321748cb29d13466a1af8862e2db384a1b","inference":{"conf":0.1,"imgsz":960,"classes":[1,2,3,5,7]},"tracker":{"fuse_score":true,"match_thresh":0.8,"new_track_thresh":0.25,"track_buffer":30,"track_high_thresh":0.25,"track_low_thresh":0.1}}},"task":{"question":"How many vehicles, if any, move opposite to the prevailing nearby traffic in the same roadway area? List their colors, and state if the total count remains uncertain.","investigation":{"used":false,"statement":"Resolve only the supplied video investigation cases. Start with context_get, use factual visual tools when needed, and finish each case with investigation_finish; do not submit an overall vehicle count.","instructions":"Program rules already compared motion in an assumed single roadway. Resolve the active case, not the whole task. For an identity question compare its two sightings; same color alone is not identity. For appearance read existing evidence first, then inspect next_best if the target was unclear. For layout inspect visible roadway separation only. Cite current observation references. If evidence does not settle the question, finish unresolved rather than guessing. Do not re-read unchanged inventory or request the same media/intent twice. Movement is derived observation; screen areas are coarse locations. Original source frames are zero-based inclusive. No confidence scores, shell, Python or arbitrary media processing. The host assembles counts/colors/intervals; do not return those as a separate answer.","system":"You investigate specific exceptions for a program-led video analysis system. Start with context_get. The host has already scanned and compared vehicle motion; you do not decide or submit the overall count. Work only on the active case. Read its question, impact and existing evidence, then choose a factual tool if it can add information.\nUse compare_windows for an identity question: it supplies actual boundary sightings. Same color alone does not establish identity. Use inspect_window appearance_check for body color, next_best for an unclear previous view, visibility_check for occlusion/co-visibility, position_check for observed locations, scene_check for roadway separation. Gemma never receives your history or a traffic-verdict question. Each case allows at most two new visual calls; do not repeat the same media and intent. Source frames are zero-based inclusive; T and V aliases are tentative and session-local. Movement is observed image-plane motion; coarse areas are locations, not direction.\nUse investigation_finish with the exact case_ref, outcome and observation_refs. For identity supply identity_relation same/different/unresolved; for layout roadway_status single/multiple/unclear. An appearance color_quote must be an exact substring of a cited appearance observation, describing body color, not movement. Preserve free shades and two-tone descriptions. If unclear, finish unresolved; do not guess. No overall count/colors submission, shell, Python, arbitrary queries or sampling changes. When no case remains, stop.\nFictional example: compare_windows({refs:[\"T_example_a\",\"T_example_b\"],intent:\"correspondence_check\"}); then investigation_finish({case_ref:\"C_example\",outcome:\"unresolved\",observation_refs:[\"O_example\"],identity_relation:\"unresolved\"}). Runtime Verifier checks shape/source/resources, not semantic truth. The host assembles the final answer.","tools":{"compare_windows":"Compare exactly two refs at boundary sightings, or two explicit segments. Independent supplied sightings are not a continuous observed path. intent is correspondence_check.","context_get":"Read the active case, related records, original task and remaining budgets. No new inference.","inspect_window":"Check a factual question for ref. Appearance gives marked full image and original crop. next_best selects a different actual frame. Optional start/end must be paired. Targetless scene_check defaults to a middle frame.","investigation_finish":"End only the active case. Resolved identity/layout needs cited visual observations and its typed result. Appearance color_quote is verbatim cited body-color text. Unresolved is legitimate; the host owns final count and assembly.","observation_get":"Read one current ref: V vehicle, T track, O observation, cursor or inventory. raw requests actual positions; frames only with raw track/vehicle. Existing evidence is not a new visual call."}}},"runtime":{"candidate_revision":"v5.0","roadway_mode":"single_comparable_roadway_assumed","model_calls":20,"visual_calls":12,"case_limit":4,"case_visual_limit":2,"tool_text_total":12000,"control_text_reserve":1000,"tool_text_page":2500,"max_inspect_seconds":2,"inspect_source_frame_cap":6,"crop_padding":0.25,"link_gap_fps_fraction":0.3,"link_iou":0.1,"link_distance_diagonals":0.5,"link_area_ratio":4,"link_angle_degrees":60,"possible_gap_fps_fraction":1,"possible_distance_diagonals":1.5,"possible_area_ratio":6,"stable_motion_fraction":0.8,"direction_cone_degrees":45,"majority_fraction":0.6666666666666666,"comparison_min_units":2,"opposite_angle_degrees":135},"video":{"fps":10.0,"width":960,"height":540,"nb_frames":199,"duration_sec":19.9,"proxy":"video/2-nominal-r1.mp4"},"tracking":{"classes":{"1":"bicycle","2":"car","3":"motorcycle","5":"bus","7":"truck"},"tracks":[{"alias":"T1","raw_id":2,"observed":[13,20],"vehicle":"V1"},{"alias":"T2","raw_id":3,"observed":[14,45],"vehicle":"V2"},{"alias":"T3","raw_id":6,"observed":[18,35],"vehicle":"V3"},{"alias":"T4","raw_id":8,"observed":[22,54],"vehicle":"V4"},{"alias":"T5","raw_id":10,"observed":[24,64],"vehicle":"V1"},{"alias":"T6","raw_id":28,"observed":[48,76],"vehicle":"V6"},{"alias":"T7","raw_id":32,"observed":[55,88],"vehicle":"V7"},{"alias":"T8","raw_id":35,"observed":[59,88],"vehicle":"V8"},{"alias":"T9","raw_id":36,"observed":[62,90],"vehicle":"V9"},{"alias":"T10","raw_id":49,"observed":[84,85],"vehicle":"V10"},{"alias":"T11","raw_id":51,"observed":[85,87],"vehicle":"V11"},{"alias":"T12","raw_id":54,"observed":[88,102],"vehicle":"V10"},{"alias":"T13","raw_id":56,"observed":[90,115],"vehicle":"V13"},{"alias":"T14","raw_id":62,"observed":[99,128],"vehicle":"V14"},{"alias":"T15","raw_id":66,"observed":[111,113],"vehicle":"V15"},{"alias":"T16","raw_id":70,"observed":[117,140],"vehicle":"V15"},{"alias":"T17","raw_id":72,"observed":[123,126],"vehicle":"V17"},{"alias":"T18","raw_id":73,"observed":[128,153],"vehicle":"V17"}],"frames":[{"d":[],"p":[]},{"d":[],"p":[]},{"d":[],"p":[]},{"d":[],"p":[]},{"d":[],"p":[]},{"d":[],"p":[]},{"d":[],"p":[]},{"d":[],"p":[]},{"d":[],"p":[]},{"d":[[431.8,0.0,455.1,4.8,2,-1,-1]],"p":[]},{"d":[[560.9,298.8,695.9,505.6,2,-1,0],[430.4,0.0,454.1,8.4,2,-1,1]],"p":[]},{"d":[[556.7,268.1,674.5,446.0,2,-1,0],[429.0,0.0,454.0,12.5,2,-1,1]],"p":[]},{"d":[[551.8,242.0,656.8,396.6,2,-1,0],[428.1,0.0,453.5,16.7,2,-1,1]],"p":[]},{"d":[[546.7,215.4,642.9,353.4,5,0,0],[427.4,0.0,452.3,20.5,2,-1,1]],"p":[]},{"d":[[426.6,0.0,452.3,25.9,2,1,1],[543.1,192.3,630.7,318.4,5,0,0],[543.6,192.5,630.8,318.1,7,-1,-1]],"p":[]},{"d":[[425.4,2.0,450.8,31.1,2,1,1],[540.0,172.0,620.4,286.8,5,0,0],[539.9,172.0,620.5,286.8,7,-1,-1]],"p":[]},{"d":[[537.1,152.3,611.3,259.7,7,0,0],[423.5,7.1,450.1,35.2,2,1,1]],"p":[]},{"d":[[421.8,10.6,449.8,41.5,2,1,1],[534.6,136.3,603.6,235.9,5,0,0],[534.7,135.9,603.7,236.0,7,-1,2]],"p":[]},{"d":[[420.7,15.5,449.1,46.9,2,1,1],[531.6,120.4,596.3,213.3,7,0,0],[531.4,121.0,596.4,213.3,5,2,2]],"p":[]},{"d":[[529.7,107.3,590.5,193.9,7,0,0],[419.3,20.7,448.4,53.7,2,1,1],[529.6,107.4,590.5,194.1,5,2,2]],"p":[]},{"d":[[527.9,95.5,584.9,176.5,7,0,0],[417.3,25.7,446.8,58.9,2,1,1],[527.7,95.9,584.8,176.7,5,2,2],[578.8,458.9,687.6,540.0,7,-1,-1]],"p":[]},{"d":[[414.7,31.4,446.3,66.9,2,1,1],[526.1,83.5,579.6,161.0,7,2,2],[571.9,408.1,687.8,538.6,2,-1,-1],[572.4,408.0,688.0,538.7,5,-1,-1]],"p":[[525.9,78.4,575.9,151.4,0]]},{"d":[[562.9,366.0,683.1,540.0,2,3,3],[413.6,37.3,445.5,74.6,2,1,1],[523.3,72.6,575.0,146.0,7,2,2]],"p":[[521.0,59.2,571.0,132.2,0]]},{"d":[[557.9,327.6,665.0,482.9,2,3,3],[411.8,43.4,444.6,82.4,2,1,1],[523.3,63.7,570.6,132.8,7,2,2],[523.3,63.7,570.6,132.8,5,-1,0]],"p":[[516.1,40.0,566.0,113.0,0]]},{"d":[[552.2,294.9,650.0,430.3,2,3,3],[409.6,48.9,443.1,90.0,2,1,1],[520.8,54.9,566.6,121.5,7,2,2],[520.8,55.4,566.6,121.4,5,4,0],[520.7,54.9,566.6,121.7,2,-1,-1]],"p":[[511.1,20.8,561.1,93.8,0]]},{"d":[[548.2,267.1,637.7,386.2,2,3,3],[406.9,56.2,441.9,99.3,2,1,1],[519.2,47.1,563.4,109.6,2,2,2]],"p":[[506.2,1.6,556.2,74.6,0],[521.5,57.1,567.2,123.6,4]]},{"d":[[544.0,241.9,625.7,347.0,2,3,3],[404.1,63.2,440.4,109.9,2,1,1],[517.7,38.9,560.2,99.7,2,2,2]],"p":[[501.3,-17.7,551.2,55.4,0],[521.5,57.1,567.2,123.6,4]]},{"d":[[540.7,219.1,616.6,314.4,2,3,3],[401.5,70.6,439.3,120.1,2,1,1],[516.7,31.8,557.3,90.1,2,2,2]],"p":[[496.3,-36.9,546.3,36.1,0],[521.5,57.1,567.2,123.6,4]]},{"d":[[397.6,79.2,438.6,131.1,2,1,1],[537.0,199.5,607.9,285.2,2,3,3],[515.4,25.4,554.6,81.3,2,2,2]],"p":[[491.4,-56.1,541.4,16.9,0],[521.5,57.1,567.2,123.6,4]]},{"d":[[533.6,180.8,600.9,259.3,2,3,3],[394.2,87.6,437.7,142.8,2,1,1],[514.1,18.9,551.7,73.2,7,2,2]],"p":[[486.5,-75.3,536.4,-2.3,0],[521.5,57.1,567.2,123.6,4]]},{"